<videos xmlns="http://www.videos.es/tds" xmlns:xs="http://www.w3.org/2001/XMLSchema-instance"
        xs:schemaLocation="http://www.videos.es/tds videos.xsd">
    <video titulo="Luis Fonsi - Sola" url="https://www.youtube.com/watch?v=sKlA0A3ufpc" >
        <etiqueta nombre="Reggaeton"/>
        <etiqueta nombre="Music"/>
    </video>
    <video titulo="Daft Punk - Instant Crush" url="https://www.youtube.com/watch?v=a5uQMwRMHcs">
        <etiqueta nombre="Music"/>
        <etiqueta nombre="Electro"/>
    </video>
    <video titulo="Daft Punk ft Pharrell Williams - Get Lucky" url="https://www.youtube.com/watch?v=5NV6Rdv1a3I" >
        <etiqueta nombre="Electro" />
    </video>
</videos>