<?xml version="1.0" ?>
<videos xmlns="http://www.videos.es/tds" xmlns:xs="http://www.w3.org/2001/XMLSchema-instance"
	xs:schemaLocation="http://www.videos.es/tds videos.xsd">
	<video titulo="Top 5 Hidden Indie Gems of October 2018" url="https://www.youtube.com/watch?v=4uiaZhgren4" >
		<etiqueta nombre="games"/>
		<etiqueta nombre="indie"/>
	</video>
    <video titulo="The DÃ¸ I A Take Away Show" url="https://www.youtube.com/watch?v=qu577tNp1hA" >
        <etiqueta nombre="music"/>
        <etiqueta nombre="blogotheque"/>
        <etiqueta nombre="solo"/>
    </video>
    <video titulo="Pay Attention - 'Dangerous Business' Preview | Star Wars Resistance" url="https://www.youtube.com/watch?v=R5NyB_bAZI8" >
        <etiqueta nombre="cartoon"/>
        <etiqueta nombre="StarWars"/>
    </video>
    <video titulo="Star Wars The Clone Wars - Master Yoda Vs Droid Battalion [1080p]" url="https://www.youtube.com/watch?v=qTktSFh1UJA" >
        <etiqueta nombre="cartoon"/>
        <etiqueta nombre="StarWars"/>
    </video>
    <video titulo="Gandalf 10 hours" url="https://www.youtube.com/watch?v=G1IbRujko-A">
        <etiqueta nombre="Chilling"/>
    </video>
 </videos>
